stage_id,form_section,field_id,field_name,field_type,validation_rules,required_status,possible_values,dependencies,help_text,current_implementation,feedback_category,user_rating,user_comments,improvement_suggestions,priority_level
7,Project Readiness Assessment,projectCode,Project Code,text,"readonly calculated",calculated,"HMDA/EE/2025/0001",from_previous_stages,Project code from quality control stage,Not Implemented,data_flow,,,,Ensure seamless transition from QC stage,high
7,Project Readiness Assessment,constructionCompletionStatus,Construction Completion Status,select,"readonly calculated",calculated,"Substantially Complete,Minor Work Pending,Major Work Pending",from_stage5,Overall construction completion status,Not Implemented,data_flow,,,,Add completion verification mechanisms,high
7,Project Readiness Assessment,qualityControlStatus,Quality Control Status,select,"readonly calculated",calculated,"Quality Approved,Quality Issues Resolved,Quality Pending",from_stage6,Quality control clearance status,Not Implemented,data_flow,,,,Add QC clearance automation,high
7,Project Readiness Assessment,testingReadiness,Testing Readiness Assessment,select,required,required,"Ready for Testing,Partially Ready,Not Ready",readiness_evaluation,Overall readiness for testing and commissioning,Not Implemented,functionality,,,,Add readiness checklist automation,high
7,Pre-Commissioning Activities,systemIsolation,System Isolation Status,select,required,required,"Completed,In Progress,Not Started",pre_commissioning_step,Status of system isolation for testing,Not Implemented,functionality,,,,Add isolation verification procedures,high
7,Pre-Commissioning Activities,systemCleaning,System Cleaning Status,select,required,required,"Completed,In Progress,Not Started",pre_commissioning_step,Status of system cleaning and preparation,Not Implemented,functionality,,,,Add cleaning standards checklist,medium
7,Pre-Commissioning Activities,equipmentInstallation,Equipment Installation Status,select,required,required,"All Installed,Partially Installed,Installation Pending",installation_tracking,Status of equipment installation,Not Implemented,functionality,,,,Add equipment installation verification,high
7,Pre-Commissioning Activities,cableTermination,Cable Termination Status,select,optional,optional,"Completed,In Progress,Not Started,Not Applicable",electrical_systems,Status of electrical cable termination,Not Implemented,functionality,,,,Add cable testing integration,medium
7,Pre-Commissioning Activities,pipingPressureTest,Piping Pressure Test Status,select,optional,optional,"Passed,Failed,In Progress,Not Applicable",mechanical_systems,Status of piping pressure tests,Not Implemented,functionality,,,,Add pressure test automation,high
7,Pre-Commissioning Activities,instrumentCalibration,Instrument Calibration Status,select,optional,optional,"Completed,In Progress,Pending,Not Applicable",instrumentation_systems,Status of instrument calibration,Not Implemented,functionality,,,,Add calibration certificate tracking,medium
7,Individual System Testing,electricalSystemTest,Electrical System Testing,select,required,required,"Passed,Failed,In Progress,Not Started",system_testing,Status of electrical system testing,Not Implemented,functionality,,,,Add electrical test result integration,high
7,Individual System Testing,mechanicalSystemTest,Mechanical System Testing,select,optional,optional,"Passed,Failed,In Progress,Not Started,Not Applicable",system_testing,Status of mechanical system testing,Not Implemented,functionality,,,,Add mechanical test procedures,medium
7,Individual System Testing,hvacSystemTest,HVAC System Testing,select,optional,optional,"Passed,Failed,In Progress,Not Started,Not Applicable",system_testing,Status of HVAC system testing,Not Implemented,functionality,,,,Add HVAC performance standards,medium
7,Individual System Testing,plumbingSystemTest,Plumbing System Testing,select,optional,optional,"Passed,Failed,In Progress,Not Started,Not Applicable",system_testing,Status of plumbing system testing,Not Implemented,functionality,,,,Add plumbing test automation,medium
7,Individual System Testing,fireAlarmSystemTest,Fire Alarm System Testing,select,optional,optional,"Passed,Failed,In Progress,Not Started,Not Applicable",safety_systems,Status of fire alarm system testing,Not Implemented,functionality,,,,Add fire safety compliance verification,high
7,Individual System Testing,securitySystemTest,Security System Testing,select,optional,optional,"Passed,Failed,In Progress,Not Started,Not Applicable",security_systems,Status of security system testing,Not Implemented,functionality,,,,Add security system verification,medium
7,Individual System Testing,communicationSystemTest,Communication System Testing,select,optional,optional,"Passed,Failed,In Progress,Not Started,Not Applicable",communication_systems,Status of communication system testing,Not Implemented,functionality,,,,Add communication test protocols,low
7,Individual System Testing,totalSystemsToTest,Total Systems to Test,number,"readonly calculated",calculated,auto_counted_applicable_systems,system_inventory,Total number of systems requiring testing,Not Implemented,calculation,,,,Add system testing matrix,medium
7,Individual System Testing,systemsTestPassed,Systems Test Passed,number,"readonly calculated",calculated,auto_counted_passed_systems,test_results,Number of systems that passed testing,Not Implemented,calculation,,,,Add system test result dashboard,medium
7,Individual System Testing,systemTestPassRate,System Test Pass Rate (%),number,"readonly calculated",calculated,passed_vs_total_percentage,performance_calculation,Percentage of systems passing tests,Not Implemented,calculation,,,,Add test pass rate benchmarking,medium
7,Integrated System Testing,integratedTestPlan,Integrated Test Plan Status,select,required,required,"Approved,Under Review,Pending Submission",test_planning,Status of integrated system test plan,Not Implemented,functionality,,,,Add integrated test plan templates,high
7,Integrated System Testing,systemIntegrationTest,System Integration Testing,select,required,required,"Passed,Failed,In Progress,Not Started",integration_testing,Status of system integration testing,Not Implemented,functionality,,,,Add integration test automation,high
7,Integrated System Testing,loadTesting,Load Testing Status,select,optional,optional,"Passed,Failed,In Progress,Not Started,Not Applicable",performance_testing,Status of system load testing,Not Implemented,functionality,,,,Add load testing standards,medium
7,Integrated System Testing,enduranceTest,Endurance Testing Status,select,optional,optional,"Passed,Failed,In Progress,Not Started,Not Applicable",reliability_testing,Status of system endurance testing,Not Implemented,functionality,,,,Add endurance test protocols,medium
7,Integrated System Testing,interferenceTest,Interference Testing Status,select,optional,optional,"Passed,Failed,In Progress,Not Started,Not Applicable",compatibility_testing,Status of electromagnetic interference testing,Not Implemented,functionality,,,,Add interference test procedures,low
7,Integrated System Testing,failsafeTest,Fail-safe Testing Status,select,optional,optional,"Passed,Failed,In Progress,Not Started,Not Applicable",safety_testing,Status of fail-safe mechanism testing,Not Implemented,functionality,,,,Add fail-safe test verification,high
7,Integrated System Testing,backupSystemTest,Backup System Testing,select,optional,optional,"Passed,Failed,In Progress,Not Started,Not Applicable",redundancy_testing,Status of backup system testing,Not Implemented,functionality,,,,Add backup system protocols,medium
7,Performance Validation,performanceParameterTest,Performance Parameter Testing,select,required,required,"All Parameters Met,Some Parameters Failed,Testing In Progress",performance_validation,Status of performance parameter validation,Not Implemented,functionality,,,,Add performance parameter automation,high
7,Performance Validation,efficiencyTest,Efficiency Testing Status,select,required,required,"Target Achieved,Below Target,Testing In Progress",efficiency_validation,Status of system efficiency testing,Not Implemented,functionality,,,,Add efficiency benchmarking,high
7,Performance Validation,capacityTest,Capacity Testing Status,select,required,required,"Full Capacity Achieved,Partial Capacity,Testing In Progress",capacity_validation,Status of system capacity testing,Not Implemented,functionality,,,,Add capacity verification procedures,high
7,Performance Validation,accuracyTest,Accuracy Testing Status,select,optional,optional,"Within Tolerance,Outside Tolerance,Testing In Progress,Not Applicable",precision_validation,Status of system accuracy testing,Not Implemented,functionality,,,,Add accuracy calibration procedures,medium
7,Performance Validation,responseTimeTest,Response Time Testing,select,optional,optional,"Within Limits,Exceeds Limits,Testing In Progress,Not Applicable",performance_validation,Status of system response time testing,Not Implemented,functionality,,,,Add response time optimization,medium
7,Performance Validation,reliabilityTest,Reliability Testing Status,select,required,required,"Reliable,Reliability Issues,Testing In Progress",reliability_validation,Status of system reliability testing,Not Implemented,functionality,,,,Add reliability improvement tracking,high
7,Safety System Validation,emergencyShutdownTest,Emergency Shutdown Testing,select,required,required,"Passed,Failed,Testing In Progress",safety_validation,Status of emergency shutdown system testing,Not Implemented,functionality,,,,Add emergency response automation,high
7,Safety System Validation,safetyInterlockTest,Safety Interlock Testing,select,required,required,"Passed,Failed,Testing In Progress",safety_validation,Status of safety interlock system testing,Not Implemented,functionality,,,,Add interlock verification procedures,high
7,Safety System Validation,alarmSystemTest,Alarm System Testing,select,required,required,"Passed,Failed,Testing In Progress",safety_validation,Status of alarm system testing,Not Implemented,functionality,,,,Add alarm system integration,medium
7,Safety System Validation,protectiveDeviceTest,Protective Device Testing,select,required,required,"Passed,Failed,Testing In Progress",safety_validation,Status of protective device testing,Not Implemented,functionality,,,,Add protective device certification,medium
7,Safety System Validation,safetyCertification,Safety Certification Status,select,optional,optional,"Certified,Conditional,Rejected,Pending",safety_compliance,Status of safety system certification,Not Implemented,functionality,,,,Add safety certification automation,high
7,Documentation & Certification,operatingManuals,Operating Manuals Status,select,required,required,"Complete,Incomplete,Under Review",documentation_requirement,Status of system operating manuals,Not Implemented,functionality,,,,Add manual completeness verification,high
7,Documentation & Certification,maintenanceManuals,Maintenance Manuals Status,select,required,required,"Complete,Incomplete,Under Review",documentation_requirement,Status of maintenance procedure manuals,Not Implemented,functionality,,,,Add maintenance manual integration,high
7,Documentation & Certification,testCertificates,Test Certificates Status,select,required,required,"All Received,Partial,Pending",certification_requirement,Status of system test certificates,Not Implemented,functionality,,,,Add certificate verification automation,high
7,Documentation & Certification,warrantyDocuments,Warranty Documents Status,select,required,required,"Complete,Incomplete,Pending",documentation_requirement,Status of equipment warranty documents,Not Implemented,functionality,,,,Add warranty tracking system,medium
7,Documentation & Certification,asBuiltDrawings,As-Built Drawings Status,select,required,required,"Complete,Incomplete,Under Review",documentation_requirement,Status of as-built engineering drawings,Not Implemented,functionality,,,,Add drawing revision control,high
7,Documentation & Certification,commissioningCertificate,Commissioning Certificate Status,select,optional,optional,"Issued,Conditional,Rejected,Pending",certification_outcome,Status of commissioning certificate,Not Implemented,functionality,,,,Add certificate issuance automation,high
7,Training & Handover,operatorTraining,Operator Training Status,select,required,required,"Completed,In Progress,Scheduled,Not Started",knowledge_transfer,Status of operator training program,Not Implemented,functionality,,,,Add training effectiveness assessment,high
7,Training & Handover,maintenanceTraining,Maintenance Training Status,select,required,required,"Completed,In Progress,Scheduled,Not Started",knowledge_transfer,Status of maintenance staff training,Not Implemented,functionality,,,,Add maintenance training certification,high
7,Training & Handover,systemHandoverDate,System Handover Date,date,optional,optional,date_format,commissioning_complete,Date when system was handed over,Not Implemented,field_design,,,,Add handover documentation automation,high
7,Training & Handover,handoverDocumentation,Handover Documentation Status,select,optional,optional,"Complete,Incomplete,Under Preparation",handover_requirement,Status of system handover documentation,Not Implemented,functionality,,,,Add handover checklist automation,high
7,Training & Handover,userAcceptance,User Acceptance Status,select,optional,optional,"Accepted,Conditional Acceptance,Rejected,Pending",acceptance_criteria,Status of user acceptance testing,Not Implemented,functionality,,,,Add user acceptance criteria,high
7,Performance Testing Results,designCapacityAchievement,Design Capacity Achievement (%),number,"min=0 max=150",optional,percentage_value,performance_measurement,Percentage of design capacity achieved,Not Implemented,validation,,,,Add capacity optimization recommendations,high
7,Performance Testing Results,efficiencyAchievement,Efficiency Achievement (%),number,"min=0 max=120",optional,percentage_value,performance_measurement,Percentage of target efficiency achieved,Not Implemented,validation,,,,Add efficiency improvement tracking,high
7,Performance Testing Results,energyConsumption,Energy Consumption (kWh),number,"min=0",optional,numeric_positive,energy_measurement,Actual energy consumption during testing,Not Implemented,validation,,,,Add energy efficiency benchmarking,medium
7,Performance Testing Results,waterConsumption,Water Consumption (Liters),number,"min=0",optional,numeric_positive,water_measurement,Actual water consumption during testing,Not Implemented,validation,,,,Add water conservation tracking,medium
7,Performance Testing Results,noiseLevel,Noise Level (dB),number,"min=0 max=120",optional,decibel_measurement,environmental_measurement,Measured noise level during operation,Not Implemented,validation,,,,Add noise compliance verification,medium
7,Performance Testing Results,vibrationLevel,Vibration Level (mm/s),number,"min=0",optional,vibration_measurement,mechanical_measurement,Measured vibration level during operation,Not Implemented,validation,,,,Add vibration monitoring system,low
7,Issue Resolution,testingIssuesIdentified,Testing Issues Identified,number,"min=0",optional,numeric_positive,issue_tracking,Total number of issues identified during testing,Not Implemented,validation,,,,Add issue categorization system,high
7,Issue Resolution,criticalIssues,Critical Issues Count,number,"min=0",optional,numeric_positive,severity_tracking,Number of critical issues identified,Not Implemented,validation,,,,Add critical issue escalation,high
7,Issue Resolution,issuesResolved,Issues Resolved,number,"min=0",optional,numeric_positive,resolution_tracking,Number of testing issues resolved,Not Implemented,validation,,,,Add issue resolution tracking,high
7,Issue Resolution,pendingIssues,Pending Issues,number,"calculated readonly",calculated,identified_minus_resolved,auto_calculation,Number of issues pending resolution,Not Implemented,calculation,,,,Add pending issue management,high
7,Issue Resolution,issueResolutionTime,Average Issue Resolution Time (Days),number,"calculated readonly",calculated,auto_calculated_average,time_tracking,Average time for issue resolution,Not Implemented,calculation,,,,Add resolution time optimization,medium
7,Issue Resolution,retestingRequired,Retesting Required,select,optional,optional,"No Retesting,Partial Retesting,Complete Retesting",issue_impact,Level of retesting required after issue resolution,Not Implemented,functionality,,,,Add retesting procedures,high
7,Commissioning Approval,commissioning_team_lead,Commissioning Team Lead,text,required,required,team_member,team_assignment,Lead engineer for commissioning activities,Not Implemented,field_design,,,,Add team lead qualification tracking,medium
7,Commissioning Approval,external_commissioning_agency,External Commissioning Agency,text,optional,optional,agency_details,external_validation,Third-party commissioning agency (if applicable),Not Implemented,field_design,,,,Add agency certification verification,medium
7,Commissioning Approval,commissioning_report_status,Commissioning Report Status,select,required,required,"Draft,Under Review,Approved,Rejected",report_status,Status of commissioning report,Not Implemented,functionality,,,,Add report approval workflow,high
7,Commissioning Approval,commissioning_approval_date,Commissioning Approval Date,date,optional,optional,date_format,approval_granted,Date when commissioning was approved,Not Implemented,field_design,,,,Add approval notification system,medium
7,Commissioning Approval,commissioning_certificate_number,Commissioning Certificate Number,text,optional,optional,certificate_reference,certification_issued,Reference number of commissioning certificate,Not Implemented,validation,,,,Add certificate number validation,medium
7,Commissioning Approval,conditional_approval_conditions,Conditional Approval Conditions,textarea,optional,optional,free_text,conditional_approval,Conditions attached to commissioning approval,Not Implemented,field_design,,,,Add condition tracking system,high
7,Final System Status,system_operational_status,System Operational Status,select,required,required,"Fully Operational,Partially Operational,Not Operational",operational_assessment,Overall operational status of commissioned system,Not Implemented,functionality,,,,Add operational status monitoring,high
7,Final System Status,system_performance_rating,System Performance Rating,select,required,required,"Excellent,Good,Satisfactory,Poor",performance_assessment,Overall performance rating of commissioned system,Not Implemented,field_design,,,,Add performance rating standards,high
7,Final System Status,handover_to_operations,Handover to Operations Status,select,required,required,"Completed,Scheduled,Pending",transition_management,Status of handover to operations team,Not Implemented,functionality,,,,Add operations handover automation,high
7,Final System Status,commissioning_completion_date,Commissioning Completion Date,date,optional,optional,date_format,commissioning_finished,Date when commissioning was completed,Not Implemented,field_design,,,,Add completion milestone tracking,medium
7,Final System Status,next_maintenance_date,Next Maintenance Due Date,date,"calculated readonly",calculated,commissioning_plus_interval,maintenance_scheduling,Calculated date for next scheduled maintenance,Not Implemented,calculation,,,,Add maintenance calendar integration,medium